link,type,publisher,published,imageSource,imageAlt
https://www.bbc.co.uk/programmes/p0bv8k8y,Programmes,BBC News,Check BBC for Programme release,https://ichef.bbci.co.uk/images/ic/314x176/p0bvgwbm.jpg,War In Ukraine
https://www.bbc.co.uk/programmes/m00163f8,Programmes,BBC News Channel,Check BBC for Programme release,https://ichef.bbci.co.uk/images/ic/314x176/p0btptwj.jpg,Ukraine: Reporting from the Front Lines
https://www.bbc.co.uk/programmes/m0015qw1,Programmes,BBC News,Check BBC for Programme release,https://ichef.bbci.co.uk/images/ic/314x176/p0btm637.jpg,The Ukraine Invasion
https://www.bbc.co.uk/programmes/m0015hx4,Programmes,BBC Radio 4,Check BBC for Programme release,https://ichef.bbci.co.uk/images/ic/314x176/p0bscr5y.jpg,Letter from Ukraine
https://www.bbc.co.uk/news/world-africa-60959467,News,BBC Radio 4,Africa,https://ichef.bbci.co.uk/news/416/cpsprodpb/F954/production/_123982836_p0byz1t5.jpg,War in Ukraine: Koko’s phone is your phone as she makes her way out
https://www.bbc.co.uk/news/world-europe-60968544,News,BBC Radio 4,Europe,https://ichef.bbci.co.uk/news/416/cpsprodpb/17C6C/production/_123988379_p0bz278t.jpg,War in Ukraine: Russian helicopter 'hit by British missile system'
https://www.bbc.co.uk/news/world-europe-60946340,News,BBC Radio 4,Europe,https://ichef.bbci.co.uk/news/416/cpsprodpb/828A/production/_123981433_leonidpanteleev.jpg,The heavy losses of an elite Russian regiment in Ukraine
https://www.bbc.co.uk/news/world-europe-60954349,News,BBC Radio 4,Europe,https://ichef.bbci.co.uk/news/416/cpsprodpb/1C27/production/_123970270_l1020612.jpg,Ukraine round-up: Possible war crimes and an attack on Russia
https://www.bbc.co.uk/news/world-europe-60956241,News,BBC Radio 4,Europe,https://ichef.bbci.co.uk/news/416/cpsprodpb/126A4/production/_123982457_p0byz3kt.jpg,Ukraine: Why the cartoon Masyanya was banned in Russia
https://www.bbc.co.uk/programmes/w172xytqxg8vm1n,Programmes,BBC World Service,7 days ago,https://ichef.bbci.co.uk/images/ic/314x176/p0bz0g6d.jpg,Weekend: Russian troops move out of northern Ukraine
https://www.bbc.co.uk/programmes/m0014ljj,Programmes,BBC News Channel,5 February,https://ichef.bbci.co.uk/images/ic/314x176/p0bmhc2t.jpg,Ukraine and Belarus: Uneasy Borders
https://www.bbc.co.uk/programmes/w3ct4176,Programmes,BBC World Service,1 day ago,https://ichef.bbci.co.uk/images/ic/314x176/p0byxst8.jpg,BBC OS Conversations: Talking to Ukraine's children
https://www.bbc.co.uk/programmes/m00169rp,Programmes,BBC Parliament,1 day ago,https://ichef.bbci.co.uk/images/ic/314x176/p08cvcml.jpg,Senedd Cymru - Welsh Parliament: Ukraine Statement
https://www.bbc.co.uk/programmes/p0byy28s,Programmes,BBC World Service,1 day ago,https://ichef.bbci.co.uk/images/ic/314x176/p0byxst8.jpg,The Documentary Podcast: Talking to Ukraine's children
https://www.bbc.co.uk/programmes/p0bywvrw,Programmes,BBC Radio 4,1 day ago,https://ichef.bbci.co.uk/images/ic/314x176/p0byw0ng.jpg,More or Less: Behind the Stats: Will the war in Ukraine cause a global wheat shortage?
https://www.bbc.co.uk/news/world-europe-60973124,News,BBC Radio 4,Europe,https://ichef.bbci.co.uk/news/416/cpsprodpb/1431F/production/_123991728_p0bz4mlk.jpg,Zelensky spokesman describes heartbreaking scenes in Ukraine
https://www.bbc.co.uk/news/uk-wales-60954187,News,BBC Radio 4,Wales,https://ichef.bbci.co.uk/news/416/cpsprodpb/4841/production/_123979481_newproject-96.png,Ukraine: Wrexham man buys £100k house for refugee family
https://www.bbc.co.uk/news/world-asia-india-60953426,News,India,1 day ago,https://ichef.bbci.co.uk/news/416/cpsprodpb/4319/production/_123977171_mediaitem123977169.jpg,Ukraine: Russia praises India for not judging war in 'one-sided way'
https://www.bbc.co.uk/news/world-europe-60938544,News,India,Europe,https://ichef.bbci.co.uk/news/416/cpsprodpb/3923/production/_123972641_volno.jpg,Why Russia is trying to encircle Ukraine's east
https://www.bbc.co.uk/news/world-europe-60972180,News,India,Europe,https://ichef.bbci.co.uk/news/416/cpsprodpb/9D89/production/_123992304_20220402_130031.jpg,Ukraine war: Polish doctor saves family's sight after bombing
https://www.bbc.co.uk/news/uk-england-south-yorkshire-60956371,News,Unknown,Sheffield & South Yorkshire,https://ichef.bbci.co.uk/news/416/cpsprodpb/129F/production/_123976740_hi075010709.jpg,"Ukraine: UK visa process dehumanising, says relative"
https://www.bbc.co.uk/programmes/w3ct3k4d,Programmes,BBC World Service,1 day ago,https://ichef.bbci.co.uk/images/ic/314x176/p0byw0ng.jpg,More or Less: Will the war in Ukraine cause a global wheat shortage?
https://www.bbc.co.uk/programmes/b03y888v,Programmes,BBC Radio 4,8 March 2014,https://ichef.bbci.co.uk/images/ic/314x176/p01t65yy.jpg,"Russia, Ukraine and Us"
https://www.bbc.co.uk/programmes/w172ykw9wdhlh5j,Programmes,BBC World Service,10 hours ago,https://ichef.bbci.co.uk/images/ic/314x176/p0bz46d2.jpg,Weekend: MP shares the shock and horror of Ukraine war
https://www.bbc.co.uk/programmes/m001663n,Programmes,BBC News Channel,1 day ago,https://ichef.bbci.co.uk/images/ic/314x176/p098vdv3.jpg,The Media Show: Ukraine's Lessons for the Media
https://www.bbc.co.uk/programmes/w172yg1g0wm8v2b,Programmes,BBC World Service,2 days ago,https://ichef.bbci.co.uk/images/ic/314x176/p0byxfzl.jpg,BBC OS: Ukraine: Oil depot attack in Russia
https://www.bbc.co.uk/news/uk-england-cumbria-60953987,News,BBC World Service,Cumbria,https://ichef.bbci.co.uk/news/416/cpsprodpb/BE61/production/_123973784_mediaitem123973782.jpg,Cumbria-Ukraine refugee scheme numbers uncertain
https://www.bbc.co.uk/news/world-europe-60970818,News,BBC World Service,Europe,https://ichef.bbci.co.uk/news/416/cpsprodpb/D8D5/production/_123990555_bucha_lee_durant.png,Ukraine war: Bucha street littered with burned-out tanks and corpses
https://www.bbc.co.uk/news/uk-60970114,News,BBC World Service,UK,https://ichef.bbci.co.uk/news/416/cpsprodpb/2ED4/production/_123988911_hi074959176.jpg,War in Ukraine: Johnson congratulates Volodymyr Zelensky over Kyiv pushback
https://www.bbc.co.uk/news/world-europe-60960155,News,BBC World Service,Europe,https://ichef.bbci.co.uk/news/416/cpsprodpb/15D54/production/_123982498_image00001.jpg,"Ukraine war: Europe's new security era, faced with Russian threat"
https://www.bbc.co.uk/news/world-europe-60968546,News,Unknown,Europe,https://ichef.bbci.co.uk/news/416/cpsprodpb/B869/production/_123990274_p0bz3bp2.jpg,War in Ukraine: Evidence grows of civilian killings in Bucha
https://www.bbc.co.uk/news/world-60968545,News,Unknown,World,https://ichef.bbci.co.uk/images/ic/314x176/p01tlf61.jpg,War in Ukraine: Amongst wreckage in Hostomel Airport near Kyiv
https://www.bbc.co.uk/news/world-europe-60967463,News,Unknown,Europe,https://ichef.bbci.co.uk/news/416/cpsprodpb/EF0E/production/_123989116_mediaitem123989113.jpg,War in Ukraine: Street in Bucha found strewn with dead bodies
https://www.bbc.co.uk/programmes/m00161m5,Programmes,BBC Radio 4,1 day ago,https://ichef.bbci.co.uk/images/ic/314x176/p0byxzst.jpg,Six O'Clock News: 02/04/2022 Reports from Ukraine say at least 20 civilians have been killed by Russian troops retreating from the town of Bucha
https://www.bbc.co.uk/news/world-europe-60929530,News,BBC Radio 4,Europe,https://ichef.bbci.co.uk/news/416/cpsprodpb/42E8/production/_123982171_mediaitem123971343.jpg,Ukraine war: Family’s bid to reach safety ends in tragedy
https://www.bbc.co.uk/programmes/m0016k41,Programmes,BBC Parliament,3 days ago,https://ichef.bbci.co.uk/images/ic/314x176/p080fyr1.jpg,House of Lords: 'Homes for Ukraine' Scheme Statement
https://www.bbc.co.uk/news/world-europe-60939320,News,BBC Parliament,Europe,https://ichef.bbci.co.uk/news/416/cpsprodpb/EDB9/production/_123975806_hi075000875.jpg,Ukraine round-up: Russia sets gas deadline for West and troops leave Chernobyl
https://www.bbc.co.uk/programmes/p0bz3l41,Programmes,BBC World Service,10 hours ago,https://ichef.bbci.co.uk/images/ic/314x176/p09kz0v5.jpg,Global News Podcast: Ukraine says it has retaken entire Kyiv region
https://www.bbc.co.uk/programmes/w172yfbw7l20jb8,Programmes,BBC World Service,1 day ago,https://ichef.bbci.co.uk/images/ic/314x176/p0bz1mm5.jpg,Newshour: Russian soldiers 'withdrawing from northern Ukraine'
https://www.bbc.co.uk/programmes/m00165v1,Programmes,BBC Radio 4,2 days ago,https://ichef.bbci.co.uk/images/ic/314x176/p0bscr5y.jpg,Letter from Ukraine: Bees and Books
https://www.bbc.co.uk/news/world-60945122,News,BBC Radio 4,World,https://ichef.bbci.co.uk/news/416/cpsprodpb/E0D4/production/_123965575_gettyimages-1239634475.jpg,Could Ukraine 'win' the war? And other questions
https://www.bbc.co.uk/news/uk-england-oxfordshire-60960960,News,BBC Radio 4,Oxford,https://ichef.bbci.co.uk/news/416/cpsprodpb/DA46/production/_123987855_36b79861-7718-4072-bc3e-df588c16146f.jpg,South Central Ambulance Service prepares to send aid to Ukraine
https://www.bbc.co.uk/news/world-africa-60939147,News,BBC Radio 4,Africa,https://ichef.bbci.co.uk/news/416/cpsprodpb/00C3/production/_123959100_p0bykq97.jpg,Nigerian student's search for a new university after fleeing Ukraine
https://www.bbc.co.uk/news/uk-england-lincolnshire-60938930,News,BBC Radio 4,Lincolnshire,https://ichef.bbci.co.uk/news/416/cpsprodpb/F880/production/_123961636_lincoln_sunderland_gettyimages-1239328392.jpg,Lincoln City to silence Dambusters March and air raid sirens due to Ukraine war
https://www.bbc.co.uk/programmes/w3ct4212,Programmes,BBC World Service,3 days ago,https://ichef.bbci.co.uk/images/ic/314x176/p0bym61m.jpg,Global Questions: Ukraine crisis: What next for Europe?
https://www.bbc.co.uk/programmes/m0016flp,Programmes,BBC Parliament,3 days ago,https://ichef.bbci.co.uk/images/ic/314x176/p0byvxg1.jpg,House of Commons: Urgent Question on the Homes for Ukraine Scheme
https://www.bbc.co.uk/programmes/m0016flk,Programmes,BBC Parliament,3 days ago,https://ichef.bbci.co.uk/images/ic/314x176/p0byvz25.jpg,House of Commons: Urgent Question on Rape as a Weapon of War in Ukraine
https://www.bbc.co.uk/news/uk-scotland-edinburgh-east-fife-60932906,News,BBC Parliament,"Edinburgh, Fife & East Scotland",https://ichef.bbci.co.uk/news/416/cpsprodpb/D7E1/production/_123956255_ukrainiansisters3.jpg,Homes for Ukraine: These people did not ask for war
https://www.bbc.co.uk/sport/live/football/60593068,News,BBC Parliament,Football,https://ichef.bbci.co.uk/news/416/cpsprodpb/FA57/production/_123978046_drawgraphic.jpg,Watch Fifa World Cup Qatar 2022 draw LIVE: England and Scotland/Wales/Ukraine in same group
https://www.bbc.co.uk/news/business-60949053,News,Unknown,Business,https://ichef.bbci.co.uk/news/416/cpsprodpb/17DB/production/_123970160_gettyimages-1239285009.jpg,"Ukraine war to halve global trade growth, warns WTO"
https://www.bbc.co.uk/news/uk-scotland-scotland-politics-60961600,News,Unknown,Scotland politics,https://ichef.bbci.co.uk/news/416/cpsprodpb/141FC/production/_123982428_gettyimages-1388937480.jpg,Homes for Ukraine: Visas for 210 Ukrainians to flee to Scotland
https://www.bbc.co.uk/news/world-europe-60952125,News,Unknown,Europe,https://ichef.bbci.co.uk/news/416/cpsprodpb/0E5D/production/_123977630_hi075012580.jpg,War in Ukraine: Russia accuses Ukraine of attacking oil depot
https://www.bbc.co.uk/news/uk-60936056,News,Unknown,UK,https://ichef.bbci.co.uk/news/416/cpsprodpb/2F2B/production/_123957021_mediaitem123957020.jpg,Ukraine: GCHQ chief warns China over 'alignment' with Russia
https://www.bbc.co.uk/programmes/m0016fkt,Programmes,BBC Parliament,4 days ago,https://ichef.bbci.co.uk/images/ic/314x176/p080fyr1.jpg,House of Lords: Ukraine Statement
https://www.bbc.co.uk/programmes/m001609d,Programmes,BBC Parliament,BBC Radio Wales,https://ichef.bbci.co.uk/images/ic/314x176/p0997dz3.jpg,"Sunday Supplement: Ukraine, Wales constitutional future & Falkands"
https://www.bbc.co.uk/news/world-europe-60931910,News,BBC Parliament,Europe,https://ichef.bbci.co.uk/news/416/cpsprodpb/160FD/production/_123956309_hi074968786.jpg,Ukraine round-up: Little progress in peace talks as shelling continues
https://www.bbc.co.uk/news/uk-scotland-60779861,News,BBC Parliament,Scotland,https://ichef.bbci.co.uk/news/416/cpsprodpb/158F4/production/_123580388_gettyimages-1228390590.jpg,"Scotland-Ukraine World Cup game likely to go ahead, expert says"
https://www.bbc.co.uk/programmes/w3cszbw3,Programmes,BBC World Service,11 September 2019,https://ichef.bbci.co.uk/images/ic/314x176/p07mp3f9.jpg,The Compass: Media Front: Media Front: Ukraine
https://www.bbc.co.uk/sport/football/60958890,Programmes,BBC World Service,European Football,https://ichef.bbci.co.uk/news/416/cpsprodpb/11235/production/_123979107_gettyimages-1369607641-1.jpg,Dynamo Kyiv to play top European clubs to raise money for Ukraine
https://www.bbc.co.uk/programmes/w172yfbw7l1xr59,Programmes,BBC World Service,2 days ago,https://ichef.bbci.co.uk/images/ic/314x176/p0byww65.jpg,Newshour: Ukraine war: attack on Russian oil depot
https://www.bbc.co.uk/news/uk-england-kent-60959865,News,BBC World Service,Kent,https://ichef.bbci.co.uk/news/416/cpsprodpb/9B80/production/_123980893_ukrainianrefugees.jpg,Ukraine: Goudhurst opens its homes to refugees
https://www.bbc.co.uk/programmes/w3ct3jc4,Programmes,BBC World Service,2 days ago,https://ichef.bbci.co.uk/images/ic/314x176/p0byx0r2.jpg,WorklifeIndia: Where does the Russia-Ukraine war leave India?
https://www.bbc.co.uk/news/world-europe-60932975,News,BBC World Service,Europe,https://ichef.bbci.co.uk/news/416/cpsprodpb/D057/production/_123953335_moscowshelf.jpg,Ukraine conflict: Russia to allow unauthorised imports from West
https://www.bbc.co.uk/news/uk-england-humber-60954543,News,BBC World Service,Humberside,https://ichef.bbci.co.uk/news/416/cpsprodpb/FE85/production/_123975156_ukraine_ambulance.jpg,Yorkshire-built armoured ambulances bound for Ukraine
https://www.bbc.co.uk/news/uk-northern-ireland-60951649,News,BBC World Service,Northern Ireland,https://ichef.bbci.co.uk/news/416/cpsprodpb/8435/production/_123754833_gettyimages-1239266171.jpg,Ukraine war: Northern Ireland advice centres to open for refugees
https://www.bbc.co.uk/news/world-europe-56720589,News,BBC World Service,Europe,https://ichef.bbci.co.uk/news/416/cpsprodpb/A5A0/production/_123900424_mariupol.jpg,Why has Russia invaded Ukraine and what does Putin want?
https://www.bbc.co.uk/news/world-60952603,News,BBC World Service,World,https://ichef.bbci.co.uk/news/416/cpsprodpb/D243/production/_123972835_p0byskqb.jpg,War in Ukraine: President Zelensky addresses Australian parliament
https://www.bbc.co.uk/news/uk-60928946,News,BBC World Service,UK,https://ichef.bbci.co.uk/news/416/cpsprodpb/C661/production/_123958705_80db23d0-60ad-4d79-a6e0-84396797e508.jpg,"Ukraine: 'I am safe, my daughter is safe, that's the main thing'"
https://www.bbc.co.uk/news/world-middle-east-60931180,News,BBC World Service,Middle East,https://ichef.bbci.co.uk/news/416/cpsprodpb/82EB/production/_123951533_p0bycfy0.jpg,Ukraine war: The Syrians signing up to fight for Russia
https://www.bbc.co.uk/news/uk-england-cumbria-60942181,News,Unknown,Cumbria,https://ichef.bbci.co.uk/news/416/cpsprodpb/128B/production/_123974740_alla.jpg,Ukraine: Visa to bring family to Cumbria 'took most of the day'
https://www.bbc.co.uk/news/world-europe-60506682,News,Unknown,Europe,https://ichef.bbci.co.uk/news/416/cpsprodpb/1D35/production/_123977470_ukraine_kyiv_index_31_03_promo976-nc.png,Ukraine war in maps: Tracking the Russian invasion
https://www.bbc.co.uk/programmes/w3ct32w4,Programmes,BBC World Service,4 days ago,https://ichef.bbci.co.uk/images/ic/314x176/p0by9vkw.jpg,Health Check: Treating stress and anxiety in Ukraine
https://www.bbc.co.uk/news/world-europe-60945666,News,BBC World Service,Europe,https://ichef.bbci.co.uk/news/416/cpsprodpb/5170/production/_123584802_chernobylbig.jpg,"Ukraine war: Russian troops leave Chernobyl, Ukraine says"
https://www.bbc.co.uk/news/world-europe-60957390,News,BBC World Service,Europe,https://ichef.bbci.co.uk/images/ic/314x176/p01tlf61.jpg,Missiles strike Russian oil depot near Ukraine
https://www.bbc.co.uk/programmes/w172yf8dxd7n5vb,Programmes,BBC World Service,4 days ago,https://ichef.bbci.co.uk/images/ic/314x176/p085qr7m.jpg,Newsday: Ukraine: Russia repositioning for attack on east
https://www.bbc.co.uk/news/world-europe-60945068,News,BBC World Service,Europe,https://ichef.bbci.co.uk/news/416/cpsprodpb/81A2/production/_123968133_gettyimages-1388627449.jpg,Ukraine war: Russian forces regrouping for attack - Nato
https://www.bbc.co.uk/news/world-europe-60953385,News,BBC World Service,Europe,https://ichef.bbci.co.uk/news/416/cpsprodpb/24DD/production/_123973490_p0bytwcl.jpg,Ukraine war: Bodies on road Russians occupied outside Kyiv
https://www.bbc.co.uk/news/world-europe-60949791,News,BBC World Service,Europe,https://ichef.bbci.co.uk/news/416/cpsprodpb/12F8B/production/_123970777_blurredgraphicdead6.jpg,Ukraine war: Gruesome evidence points to war crimes on road outside Kyiv
https://www.bbc.co.uk/news/world-europe-60867684,News,BBC World Service,Europe,https://ichef.bbci.co.uk/news/416/cpsprodpb/5B26/production/_123943332_p0by75gh.jpg,Ukraine war: Youngsters in Finland worried conflict could spread
https://www.bbc.co.uk/news/world-europe-60919744,News,Unknown,Europe,https://ichef.bbci.co.uk/news/416/cpsprodpb/D506/production/_123943545_gettyimages-1239597248.jpg,Ukraine daily round-up: Peace talks produce first sign of progress
https://www.bbc.co.uk/news/world-europe-60947770,News,Unknown,Europe,https://ichef.bbci.co.uk/news/416/cpsprodpb/2E14/production/_123969711_p0bymjlq.jpg,Ukraine war: Cars appear to drive around landmines placed in road near Kyiv
https://www.bbc.co.uk/news/world-europe-60947272,News,Unknown,Europe,https://ichef.bbci.co.uk/news/416/cpsprodpb/157A8/production/_123967978_p0byqnzt.jpg,Russian MP says Putin's plan for Ukraine hasn't been shared with their parliament
https://www.bbc.co.uk/news/entertainment-arts-60912544,News,Unknown,Entertainment & Arts,https://ichef.bbci.co.uk/news/416/cpsprodpb/1012A/production/_123943856_edcamilagettyimages-1388446251.jpg,Concert For Ukraine: Refugees' stories centre stage at £12m charity show
https://www.bbc.co.uk/programmes/w172yg1g0wm5y57,Programmes,BBC World Service,3 days ago,https://ichef.bbci.co.uk/images/ic/314x176/p0byq1ln.jpg,BBC OS: Ukraine to send buses to Mariupol
https://www.bbc.co.uk/programmes/m0015l98,Programmes,BBC World Service,BBC Radio 1,https://ichef.bbci.co.uk/images/ic/314x176/p0bvn3c8.jpg,Newsbeat: Singing for Ukraine
https://www.bbc.co.uk/news/world-europe-60938429,News,BBC World Service,Europe,https://ichef.bbci.co.uk/news/416/cpsprodpb/2639/production/_123958790_hi074988936.jpg,"Ukraine war: Russia blocks buses heading to Mariupol, says Ukraine"
https://www.bbc.com/news/articles/c7267rldy2qo,News,BBC World Service,,https://ichef.bbci.co.uk/news/416/cpsprodpb/8256/live/de2ff870-b0f3-11ec-9c80-cf61bdaf9ac0.png,Councils launch website to support Ukraine
https://www.bbc.co.uk/news/business-60945248,News,BBC World Service,Business,https://ichef.bbci.co.uk/news/416/cpsprodpb/08C6/production/_123964220_d4049b8f-3fee-4744-b37c-0dfef4d11660.jpg,Ukraine war: Russia threatens to stop supplying gas if not paid in roubles
https://www.bbc.co.uk/programmes/w3ct32fl,Programmes,BBC World Service,2 days ago,https://ichef.bbci.co.uk/images/ic/314x176/p0byn8dh.jpg,HARDtalk: Maria Butina: What is Russia achieving in Ukraine?
https://www.bbc.co.uk/news/world-europe-60936117,News,Unknown,Europe,https://ichef.bbci.co.uk/news/416/cpsprodpb/0B95/production/_123956920_mediaitem123956916.jpg,"Ukraine war: Putin being misled by fearful advisers, US says"
https://www.bbc.co.uk/news/live/world-europe-60949706,News,Unknown,Europe,https://ichef.bbci.co.uk/news/416/cpsprodpb/8E57/production/_123993463_newhi075040946.jpg,"Ukraine war latest: Killings in Bucha a deliberate massacre, says Ukraine"
https://www.bbc.co.uk/news/58888451,News,Unknown,Reality Check,https://ichef.bbci.co.uk/news/416/cpsprodpb/1B3C/production/_123627960_gettyimages-1239027740.jpg,Ukraine war: How reliant is the world on Russia for oil and gas?
https://www.bbc.co.uk/news/world-60940407,News,Unknown,World,https://ichef.bbci.co.uk/news/416/cpsprodpb/03EE/production/_123960010_p0byl4m4.jpg,Ukraine: Putin 'massively misjudged' Ukraine invasion - GCHQ
https://www.bbc.co.uk/news/uk-england-lincolnshire-60937706,News,Unknown,Lincolnshire,https://ichef.bbci.co.uk/news/416/cpsprodpb/4ED9/production/_123958102_childpa976.jpg,First 200 Homes for Ukraine scheme refugees to arrive in Lincolnshire
https://www.bbc.co.uk/programmes/p0bvhbjh,Programmes,Unknown,BBC Radio Lincolnshire,https://ichef.bbci.co.uk/images/ic/314x176/p066p3b1.jpg,William Wright: Technicolour Dreamcoat and running for Ukraine
https://www.bbc.co.uk/programmes/w172yf8dxd7k1fz,Programmes,BBC World Service,5 days ago,https://ichef.bbci.co.uk/images/ic/314x176/p085qr7m.jpg,Newsday: Ukraine peace talks expected today
https://www.bbc.co.uk/news/world-europe-60935734,News,BBC World Service,Europe,https://ichef.bbci.co.uk/news/416/cpsprodpb/2C65/production/_123956311_evacuees.png,Ukraine war: Mariupol's refugees carry wounds of battered city
https://www.bbc.co.uk/news/world-europe-60926470,News,BBC World Service,Europe,https://ichef.bbci.co.uk/news/416/cpsprodpb/43DE/production/_123947371_gettyimages-1239530517.jpg,Ukraine War: Putin demands Mariupol surrender to end shelling
https://www.bbc.co.uk/news/world-europe-60903513,News,BBC World Service,Europe,https://ichef.bbci.co.uk/news/416/cpsprodpb/1731A/production/_123920059_p0by0qf6.jpg,Ukraine war: Bringing up a baby among the bombs
https://www.bbc.co.uk/news/world-europe-60925713,News,Unknown,Europe,https://ichef.bbci.co.uk/news/416/cpsprodpb/630B/production/_123955352_hi074948618.jpg,War in Ukraine: Russia launches new attacks after peace promise
https://www.bbc.co.uk/programmes/m0015v96,Programmes,BBC Radio 4,6 days ago,https://ichef.bbci.co.uk/images/ic/314x176/p0byxzst.jpg,Six O'Clock News: 28/03/2022 Ukraine has closed humanitarian corridors for civilians to leave besieged towns because it fears Russian attacks
https://www.bbc.co.uk/sport/av/athletics/60902258,Programmes,BBC Radio 4,Athletics,https://ichef.bbci.co.uk/news/416/cpsprodpb/E395/production/_123916285_p0bxy23l.jpg,Yaroslava Mahuchikh: Winning World Indoor Championships gold 'showed Ukraine is a strong nation'
https://www.bbc.co.uk/programmes/w172yg1g0wm3508,Programmes,BBC World Service,4 days ago,https://ichef.bbci.co.uk/images/ic/314x176/p0byf3nm.jpg,BBC OS: Ukraine: UN concern over possible Russian war crimes
https://www.bbc.co.uk/programmes/p0bybtz6,Programmes,BBC Radio 4,4 days ago,https://ichef.bbci.co.uk/images/ic/314x176/p0bybv3b.jpg,Best of Today: Ukraine: Lyse Doucet on 35 days of war.
https://www.bbc.co.uk/programmes/w172yg1g0wm3184,Programmes,BBC World Service,4 days ago,https://ichef.bbci.co.uk/images/ic/314x176/p0bydxj5.jpg,BBC OS: Ukraine: Peskov plays down diplomatic progress
https://www.bbc.co.uk/programmes/m0015vfj,Programmes,BBC Radio 4,4 days ago,https://ichef.bbci.co.uk/images/ic/314x176/p0byxfyr.jpg,The Media Show: Ukraine's lessons for the media
https://www.bbc.co.uk/programmes/m0016brh,Programmes,BBC Parliament,6 days ago,https://ichef.bbci.co.uk/images/ic/314x176/p0by1mb9.jpg,House of Commons: Ukraine Statement
https://www.bbc.co.uk/news/world-europe-60932542,News,BBC Parliament,Europe,https://ichef.bbci.co.uk/news/416/cpsprodpb/12F39/production/_123952677_ovs.jpg,Media in Russia: How do Russians get news about the war in Ukraine?
https://www.bbc.co.uk/news/uk-60926093,News,BBC Parliament,UK,https://ichef.bbci.co.uk/news/416/cpsprodpb/129C/production/_123946740_microsoftteams-image-5.png,"Homes for Ukraine: 2,700 visas issued, government reveals"
https://www.bbc.co.uk/news/uk-england-hampshire-60927439,News,Unknown,Hampshire & Isle of Wight,https://ichef.bbci.co.uk/news/416/cpsprodpb/8EE8/production/_123948563_biolaanddaughters.jpg,Ukraine family in Alton 'supported with kindness'
https://www.bbc.co.uk/programmes/w172yfbw7l1qyc3,Programmes,BBC World Service,4 days ago,https://ichef.bbci.co.uk/images/ic/314x176/p0byck0r.jpg,Newshour: Ukraine: shelling of Chernihiv continues
https://www.bbc.co.uk/news/uk-england-sussex-60933264,News,BBC World Service,Sussex,https://ichef.bbci.co.uk/news/416/cpsprodpb/15DD3/production/_123955598_ukrainebakerfamily-bbc.jpg,Ukraine: Brighton man and family who fled Kyiv arrive in UK
https://www.bbc.co.uk/programmes/p0bxfrdz,Programmes,BBC News,Sussex,https://ichef.bbci.co.uk/images/ic/314x176/p0bxkkv6.jpg,Ukrainecast
https://www.bbc.co.uk/news/world-60690688,News,BBC News,World,https://ichef.bbci.co.uk/news/416/cpsprodpb/11FA9/production/_123914637_mediaitem123914636.jpg,What is a war crime and could Putin be prosecuted over Ukraine?
https://www.bbc.co.uk/programmes/m0015qm4,Programmes,BBC News Channel,12 March,https://ichef.bbci.co.uk/images/ic/314x176/p0btlbh8.jpg,Ukrainecast and the Global News Podcast
https://www.bbc.co.uk/programmes/m0015l13,Programmes,BBC Radio 4,25 March,https://ichef.bbci.co.uk/images/ic/314x176/p0byxzst.jpg,"Six O'Clock News: Moscow says it's changing its strategy in Ukraine, to focus on two Russian-backed separatist areas"
https://www.bbc.co.uk/programmes/p0byjkmf,Programmes,BBC World Service,3 days ago,https://ichef.bbci.co.uk/images/ic/314x176/p09kz0v5.jpg,Global News Podcast: UN: Russia may be guilty of war crimes in Ukraine
https://www.bbc.co.uk/sport/football/60900328,Programmes,BBC World Service,Colchester,https://ichef.bbci.co.uk/news/416/cpsprodpb/6B27/production/_123913472_shutterstock_editorial_12855344a.jpg,"Colchester United confirm £67,000 raised so far for Ukraine aid"
