link,type,publisher,published,imageSource,imageAlthttps://www.bbc.co.uk/sport/football/60900328,Programmes,BBC News Channel,Colchester,https://ichef.bbci.co.uk/news/416/cpsprodpb/6B27/production/_123913472_shutterstock_editorial_12855344a.jpg,"Colchester United confirm £67,000 raised so far for Ukraine aid"
https://www.bbc.co.uk/news/uk-england-oxfordshire-60924139,News,BBC News Channel,Oxford,https://ichef.bbci.co.uk/news/416/cpsprodpb/F4BE/production/_123945626_mediaitem123945623.jpg,Ukraine war: Oxford sculpture to show solidarity
https://www.bbc.co.uk/news/uk-scotland-60845135,News,Unknown,Scotland,https://ichef.bbci.co.uk/news/416/cpsprodpb/16455/production/_123912219_untitled-1-1.jpg,Scotland's papers: Ferry row and Putin plans to split Ukraine
https://www.bbc.co.uk/news/uk-england-hampshire-60929512,News,Unknown,Hampshire & Isle of Wight,https://ichef.bbci.co.uk/news/416/cpsprodpb/6CF6/production/_123949872_mediaitem123949868.jpg,Hampshire MPs sign up to government Homes for Ukraine scheme
https://www.bbc.co.uk/news/world-europe-60922298,News,Unknown,Europe,https://ichef.bbci.co.uk/images/ic/314x176/p01tlf61.jpg,Ukraine war: Russian missile tears hole through Mykolaiv administrative building
https://www.bbc.co.uk/news/world-europe-60916944,News,Unknown,Europe,https://ichef.bbci.co.uk/images/ic/314x176/p01tlf61.jpg,Ukraine: Sheltering with monks in a Romanian monastery
https://www.bbc.co.uk/programmes/w172yf8dxd7n236,Programmes,BBC World Service,4 days ago,https://ichef.bbci.co.uk/images/ic/314x176/p085qr7m.jpg,Newsday: Ukraine: Russia re-positioning not withdrawing
https://www.bbc.co.uk/news/world-europe-60916098,News,BBC World Service,Europe,https://ichef.bbci.co.uk/news/416/cpsprodpb/67D7/production/_123938562_chernihiv.jpg,Ukraine war: Russia says it will curb Kyiv assault as peace talks progress
https://www.bbc.co.uk/programmes/w172yf8dxd7myc2,Programmes,BBC World Service,4 days ago,https://ichef.bbci.co.uk/images/ic/314x176/p085qr7m.jpg,Newsday: Ukraine: Russia trying to mislead with withdrawal pledge
https://www.bbc.co.uk/news/uk-england-london-60869389,News,BBC World Service,London,https://ichef.bbci.co.uk/news/416/cpsprodpb/BA3D/production/_123877674_p0bxf5ff.jpg,Ukraine Refugees: Volunteers from Hillingdon organise aid effort
https://www.bbc.co.uk/news/blogs-the-papers-60896163,News,BBC World Service,The Papers,https://ichef.bbci.co.uk/news/416/cpsprodpb/1BBD/production/_123910170_index-nc.png,Newspaper headlines: Putin 'wants to divide Ukraine' and royal reforms
https://www.bbc.co.uk/programmes/p0byczqb,Programmes,BBC World Service,4 days ago,https://ichef.bbci.co.uk/images/ic/314x176/p09kz0v5.jpg,Global News Podcast: Russia launches new strikes on Ukraine after peace promise
https://www.bbc.co.uk/news/world-europe-guernsey-60914401,News,Guernsey,4 days ago,https://ichef.bbci.co.uk/news/416/cpsprodpb/F995/production/_123939836_alderneyheadteacher.jpg,Alderney head teacher takes on Ukraine charity challenge
https://www.bbc.co.uk/news/world-africa-60899738,News,Guernsey,Africa,https://ichef.bbci.co.uk/news/416/cpsprodpb/12216/production/_123926247_desmondpipelineweldinginlagosnigeria2.jpg,Ukraine war: What next for the African students who fled?
https://www.bbc.co.uk/programmes/m0015hq0,Programmes,Guernsey,BBC One,https://ichef.bbci.co.uk/images/ic/314x176/p0bs8pcq.jpg,DEC Ukraine Humanitarian Appeal
https://www.bbc.co.uk/programmes/p0bw30z6,Programmes,BBC News,BBC One,https://ichef.bbci.co.uk/images/ic/314x176/p07l9rwp.jpg,Ukraine Under Attack
https://www.bbc.co.uk/news/live/world-europe-60923158,News,Unknown,Europe,https://ichef.bbci.co.uk/news/416/cpsprodpb/AF92/production/_123964944_mediaitem123964943.jpg,Ukraine war latest: Germany condemns Putin gas supply 'blackmail'
https://www.bbc.co.uk/news/uk-wales-politics-60913700,News,Unknown,Wales politics,https://ichef.bbci.co.uk/news/416/cpsprodpb/13186/production/_123941287_gettyimages-1384228293.jpg,Ukraine refugees: Welsh businesses asked for accommodation
https://www.bbc.co.uk/news/world-europe-60912474,News,Unknown,Europe,https://ichef.bbci.co.uk/news/416/cpsprodpb/2816/production/_123926201_abramovich.jpg,Russia-Ukraine war: Abramovich spotted in Istanbul peace talks
https://www.bbc.co.uk/news/world-europe-60891801,News,Unknown,Europe,https://ichef.bbci.co.uk/news/416/cpsprodpb/3C5A/production/_123905451_night3.jpg,How the sex trade preys on Ukraine's refugees
https://www.bbc.co.uk/programmes/p0by7q80,Programmes,BBC World Service,5 days ago,https://ichef.bbci.co.uk/images/ic/314x176/p09kz0v5.jpg,Global News Podcast: Western leaders urge caution on Russia’s pledge to reduce attacks on Ukraine
https://www.bbc.co.uk/news/uk-england-stoke-staffordshire-60918477,News,BBC World Service,Stoke & Staffordshire,https://ichef.bbci.co.uk/news/416/cpsprodpb/23E9/production/_123939190_microsoftteams-image-1.png,Staffordshire teacher 'over the moon' to be home from Ukraine
https://www.bbc.co.uk/sport/football/60889799,News,BBC World Service,Kelty Hearts,https://ichef.bbci.co.uk/news/416/cpsprodpb/9F1A/production/_123903704_20417832.jpg,Kelty Hearts: Title hero Max Kucheriavyi hopes he has made his family in Ukraine proud
https://www.bbc.co.uk/news/world-europe-60886295,News,BBC World Service,Europe,https://ichef.bbci.co.uk/news/416/cpsprodpb/157F2/production/_123905088_brit_ex_troops_ukraine1_976.jpg,"Ukraine war is our war, say Brit ex-squaddies heading to Lviv"
https://www.bbc.co.uk/programmes/w3ct2ds1,Programmes,BBC World Service,6 days ago,https://ichef.bbci.co.uk/images/ic/314x176/p08vpp9b.jpg,The Climate Question: What does war in Ukraine mean for the climate? Part 1: Russian gas
https://www.bbc.co.uk/news/world-asia-60915320,News,Unknown,Asia,https://ichef.bbci.co.uk/news/416/cpsprodpb/BD76/production/_123920584_everest.jpg,Ukraine calls for Nepal to ban Russian climbers from Himalayas
https://www.bbc.co.uk/news/uk-england-london-60904560,News,Unknown,London,https://ichef.bbci.co.uk/news/416/cpsprodpb/16C61/production/_123918239_p0bxyhtr.jpg,Ukraine Refugees: 'We run because we have to'
https://www.bbc.co.uk/news/world-europe-60920588,News,Unknown,Europe,https://ichef.bbci.co.uk/news/416/cpsprodpb/176AA/production/_123941959_gettyimages-1227802694-1.jpg,Ukraine war: Dozens of Russian diplomats expelled by four EU nations
https://www.bbc.co.uk/news/uk-wales-60916692,News,Unknown,Wales,https://ichef.bbci.co.uk/news/416/cpsprodpb/CBE1/production/_123939125_pic.jpg,Russia-Ukraine war: Flag torn down in Pembrokeshire
https://www.bbc.co.uk/news/world-europe-60887974,News,Unknown,Europe,https://ichef.bbci.co.uk/news/416/cpsprodpb/17C28/production/_123902379_tv074890740.jpg,Ukraine war: Five wounded after explosions hit western city of Lviv
https://www.bbc.co.uk/programmes/w172yfbw7l1n1g0,Programmes,BBC World Service,5 days ago,https://ichef.bbci.co.uk/images/ic/314x176/p0by58kw.jpg,Newshour: Russia says it will shift focus away from northern Ukraine
https://www.bbc.co.uk/news/world-europe-60909309,News,BBC World Service,Europe,https://ichef.bbci.co.uk/news/416/cpsprodpb/EE04/production/_123923906_gettyimages-1239530241-1.jpg,Ukraine daily round-up: Abramovich suffered suspected poisoning at talks
https://www.bbc.co.uk/programmes/w172xv5nm3sz3d0,Programmes,BBC World Service,26 March,https://ichef.bbci.co.uk/images/ic/314x176/p0bxqtmz.jpg,Newshour: President Biden tells Ukraine 'We stand with you'
https://www.bbc.co.uk/programmes/m0016c0h,Programmes,BBC Parliament,6 days ago,https://ichef.bbci.co.uk/images/ic/314x176/p0bywsg4.jpg,House of Lords: Ukraine Visas Question
https://www.bbc.co.uk/programmes/w172xv5nm3sy4dz,Programmes,BBC World Service,26 March,https://ichef.bbci.co.uk/images/ic/314x176/p0bxpqmx.jpg,Newshour: Ukraine: has Russia's strategy changed?
https://www.bbc.co.uk/news/uk-england-hampshire-60886505,News,Unknown,Hampshire & Isle of Wight,https://ichef.bbci.co.uk/news/416/cpsprodpb/E807/production/_123899395_mediaitem123899393.jpg,War in Ukraine: Man helping to build homes for refugees in Poland
https://www.bbc.co.uk/programmes/p0bt4hcw,Programmes,Unknown,BBC Radio Stoke,https://ichef.bbci.co.uk/images/ic/314x176/p06ybzct.jpg,"Lee Blakeman: Lee catches up with Harry Richardson, who's back in Leek, having recently sheltered in a bunker in Ukraine (29/03/2022)"
https://www.bbc.co.uk/news/60854881,News,Unknown,Technology,https://ichef.bbci.co.uk/news/416/cpsprodpb/D0AE/production/_123922435_ukrtelecomgettyimages-909990698.jpg,Ukraine war: Major internet provider suffers cyber-attack
https://www.bbc.co.uk/news/world-60879945,News,Unknown,World,https://ichef.bbci.co.uk/news/416/cpsprodpb/8DE0/production/_123902363_ukraine_apartment_block_gettyimages-1095610366.jpg,Ukraine defence: Red lights and painted arrows fuel fear of Russian agents
https://www.bbc.co.uk/news/world-asia-india-60783874,News,India,5 days ago,https://ichef.bbci.co.uk/news/416/cpsprodpb/181D5/production/_123937789_gettyimages-1233780431.jpg,Ukraine crisis: Why India is buying more Russian oil
https://www.bbc.co.uk/news/world-europe-60901032,News,India,Europe,https://ichef.bbci.co.uk/news/416/cpsprodpb/7BE0/production/_123921713_mediaitem123921712.jpg,Ukraine war: Odesa defies Russia and embraces signs of life
https://www.bbc.co.uk/news/world-europe-60901024,News,India,Europe,https://ichef.bbci.co.uk/news/416/cpsprodpb/15659/production/_123914678_hi074937317.jpg,Zelensky says Ukraine prepared to discuss neutrality in peace talks
https://www.bbc.co.uk/programmes/w172yfbw7l1k4jx,Programmes,BBC World Service,6 days ago,https://ichef.bbci.co.uk/images/ic/314x176/p0bxz9nr.jpg,Newshour: Is ‘neutrality’ now on the table for Ukraine
https://www.bbc.co.uk/programmes/w172xytqxg8rymt,Programmes,BBC World Service,26 March,https://ichef.bbci.co.uk/images/ic/314x176/p0bxnlz0.jpg,Weekend: Defiant Zelensky says Ukraine inflicted heavy casualties on Russia
https://www.bbc.co.uk/programmes/w172yg1g0wlxc62,Programmes,BBC World Service,6 days ago,https://ichef.bbci.co.uk/images/ic/314x176/p0by06xm.jpg,BBC OS: Ukraine: How the sex trade preys on refugees
https://www.bbc.co.uk/news/uk-england-nottinghamshire-60879770,News,Unknown,Nottingham,https://ichef.bbci.co.uk/news/416/cpsprodpb/32A9/production/_123896921_ambulanceukraine2.jpg,Ukraine: Nottinghamshire man taking ambulance to country border
https://www.bbc.co.uk/sport/football/60904069,News,Unknown,European Football,https://ichef.bbci.co.uk/news/416/cpsprodpb/12C47/production/_123917867_gettyimages-1387977093.jpg,Ukraine crisis: European Clubs Association donates to Ukrainian clubs
https://www.bbc.co.uk/news/world-europe-60900595,News,Unknown,Europe,https://ichef.bbci.co.uk/news/416/cpsprodpb/FE89/production/_123916156_p0bxy0lw.jpg,War in Ukraine: Graphic protest by Russian artist Yevgenia Isayeva
https://www.bbc.co.uk/programmes/p0bxz2l2,Programmes,BBC World Service,6 days ago,https://ichef.bbci.co.uk/images/ic/314x176/p09kz0v5.jpg,Global News Podcast: Ukraine outlines priorities for talks with Russia
https://www.bbc.co.uk/programmes/w172xytqxg8rtwp,Programmes,BBC World Service,26 March,https://ichef.bbci.co.uk/images/ic/314x176/p0bxncbp.jpg,Weekend: Ukraine urges Russia to talk
https://www.bbc.co.uk/sport/athletics/60898354,Programmes,BBC World Service,Athletics,https://ichef.bbci.co.uk/news/416/cpsprodpb/887D/production/_123914943_gettyimages-1239386160.jpg,Athletics: Yaroslava Mahuchikh on escaping war in Ukraine and winning gold at the World Indoor Championships
https://www.bbc.co.uk/programmes/p0by1sx2,Programmes,BBC World Service,6 days ago,https://ichef.bbci.co.uk/images/ic/314x176/p09kz0v5.jpg,Global News Podcast: Abramovich suffered suspected poisoning at talks on Ukraine
https://www.bbc.co.uk/news/world-europe-60853404,News,BBC World Service,Europe,https://ichef.bbci.co.uk/news/416/cpsprodpb/2520/production/_123840590_p0bx5czv.jpg,Ukraine war: Ros Atkins on... Putin’s false ‘Nazi’ claims
https://www.bbc.co.uk/news/world-europe-60900694,News,BBC World Service,Europe,https://ichef.bbci.co.uk/news/416/cpsprodpb/E6B5/production/_123916095_gettyimages-1386514409.jpg,Ukraine war: Russian officials seize Swiss watches apparently worth millions
https://www.bbc.co.uk/news/uk-england-somerset-60889029,News,BBC World Service,Somerset,https://ichef.bbci.co.uk/news/416/cpsprodpb/477C/production/_123900381_whatsappimage2022-03-26at2.00.39pm.jpg,"Ukraine conflict: UK visa process confusing, protesters say"
https://www.bbc.co.uk/news/world-us-canada-60881915,News,Unknown,US & Canada,https://ichef.bbci.co.uk/news/416/cpsprodpb/17119/production/_123898449_gettyimages-1239498813-1.jpg,War in Ukraine: The danger of wishful Western thinking
https://www.bbc.co.uk/news/world-europe-60882156,News,Unknown,Europe,https://ichef.bbci.co.uk/news/416/cpsprodpb/939D/production/_123898773_mediaitem123896248.jpg,War in Ukraine: Change of emphasis or admission of failure by Moscow?
https://www.bbc.co.uk/news/uk-60895943,News,Unknown,UK,https://ichef.bbci.co.uk/news/416/cpsprodpb/F231/production/_123910026_maiupol.jpg,Ukraine: UK lawyer appointed to probe war crime claims
https://www.bbc.co.uk/programmes/w172xxy240ntmd3,Programmes,BBC World Service,25 March,https://ichef.bbci.co.uk/images/ic/314x176/p0bxkfym.jpg,BBC OS: Ukraine takes back towns east of Kyiv
https://www.bbc.co.uk/programmes/p0bxvzdx,Programmes,BBC World Service,7 days ago,https://ichef.bbci.co.uk/images/ic/314x176/p09kz0v5.jpg,Global News Podcast: Ukraine urges Red Cross not to open office in Russia
https://www.bbc.co.uk/programmes/w172yk16fk0mmyz,Programmes,BBC World Service,6 days ago,https://ichef.bbci.co.uk/images/ic/314x176/p0bxw3pr.jpg,World Business Report: Russian shelling of Ukraine continues
https://www.bbc.co.uk/programmes/p0bxybfd,Programmes,BBC Radio 4,6 days ago,https://ichef.bbci.co.uk/images/ic/314x176/p0bxybhq.jpg,Best of Today: Biden and the Ukraine crisis
https://www.bbc.co.uk/news/world-europe-60886147,News,BBC Radio 4,Europe,https://ichef.bbci.co.uk/news/416/cpsprodpb/6A22/production/_123907172_21c07d88-8cca-4ebf-a18e-d20ab2ed38a9.jpg,War in Ukraine: Anti-war Russians intimidated on their doorsteps
https://www.bbc.co.uk/news/world-europe-60893650,News,BBC Radio 4,Europe,https://ichef.bbci.co.uk/news/416/cpsprodpb/488A/production/_123907581_tv074760315.jpg,Army boss raises partition fears: Ukraine round-up
https://www.bbc.co.uk/news/world-asia-india-60857437,News,India,6 days ago,https://ichef.bbci.co.uk/news/416/cpsprodpb/4DE0/production/_123863991_gettyimages-1238925108-594x594.jpg,Ukraine: Medical students back in India left in the lurch
https://www.bbc.co.uk/news/uk-england-hereford-worcester-60876673,News,Unknown,Hereford & Worcester,https://ichef.bbci.co.uk/news/416/cpsprodpb/10F48/production/_123884496_kingspressassociation.jpg,Worcester school choir releases Ukraine charity single
https://www.bbc.co.uk/news/world-europe-18023383,News,Unknown,Europe,https://ichef.bbci.co.uk/news/416/cpsprodpb/15DED/production/_123418598_nato.jpg,Ukraine conflict: What is Nato and how has it responded to Russia's invasion?
https://www.bbc.co.uk/news/world-europe-60878705,News,Unknown,Europe,https://ichef.bbci.co.uk/images/ic/314x176/p01tlf61.jpg,Ukraine war: The drone pilots monitoring Russian troops
https://www.bbc.co.uk/programmes/m0016bhw,Programmes,BBC News,3 days ago,https://ichef.bbci.co.uk/images/ic/314x176/p02xkk45.jpg,Global Questions: Ukraine Crisis: What Next for Europe?
https://www.bbc.co.uk/programmes/m0015d5n,Programmes,BBC World Service,BBC Radio 2,https://ichef.bbci.co.uk/images/ic/314x176/p0bw2481.jpg,Jeremy Vine: Ukraine and Bitterns
https://www.bbc.co.uk/programmes/m0015bgf,Programmes,BBC Radio 4,1 March,https://ichef.bbci.co.uk/images/ic/314x176/p0brrprx.jpg,Ukraine: How Did We Get Here?
https://www.bbc.co.uk/programmes/m0016gmc,Programmes,BBC News Channel,in 11 days,https://ichef.bbci.co.uk/images/ic/314x176/p07l9rwp.jpg,Goodbye Home: Ukraine's Border Heartbreak
https://www.bbc.co.uk/programmes/m0003qbs,Programmes,BBC News,23 March 2019,https://ichef.bbci.co.uk/images/ic/314x176/p0742pm7.jpg,"Ukraine's Oligarch Election: The Comedian, The 'Clone' and the Chocolate King"
https://www.bbc.co.uk/programmes/b01k2g45,Programmes,Unknown,BBC Four,https://ichef.bbci.co.uk/images/ic/314x176/p01hhh2l.jpg,Ukraine's Forgotten Children
https://www.bbc.co.uk/news/uk-60867964,News,Unknown,UK,https://ichef.bbci.co.uk/news/416/cpsprodpb/5ECB/production/_123876242_hi074847034.jpg,"Ukraine not alone in fight against Russia, says Boris Johnson"
https://www.bbc.co.uk/news/uk-england-tees-60892696,News,Unknown,Tees,https://ichef.bbci.co.uk/news/416/cpsprodpb/1266A/production/_123907357_f55cd708-7781-49a7-834c-64412b36f9e6.jpg,Middlesbrough man raising aid for wife's Ukraine home
https://www.bbc.co.uk/programmes/m00161rb,Programmes,BBC Radio 4,10 hours ago,https://ichef.bbci.co.uk/images/ic/314x176/p0byxkt7.jpg,The Listening Project: Ukraine Special
https://www.bbc.co.uk/news/world-60891803,News,BBC Radio 4,World,https://ichef.bbci.co.uk/news/416/cpsprodpb/C63E/production/_123905705_c331dbf2-16ae-4f14-9aff-e7062f110077.jpg,"Ukraine: No Russia regime change plans, says Blinken"
https://www.bbc.co.uk/news/world-asia-india-60857406,News,India,25 March,https://ichef.bbci.co.uk/news/416/cpsprodpb/881E/production/_123864843_mediaitem123864024.jpg,Ukraine: India 'feeling the heat' over neutrality
https://www.bbc.co.uk/news/world-europe-60877442,News,India,Europe,https://ichef.bbci.co.uk/news/416/cpsprodpb/5E9B/production/_123891242_p0bxjczy.jpg,Ukraine war: Smoke rises from Kyiv fuel depot Russia claims it has destroyed
https://www.bbc.co.uk/sport/football/60867576,News,India,Scotland,https://ichef.bbci.co.uk/news/416/cpsprodpb/FBD3/production/_123876446_20134947.jpg,Qatar World Cup: Wales await in play-off if Scotland get past Ukraine
https://www.bbc.co.uk/news/world-europe-60848612,News,Unknown,Europe,https://ichef.bbci.co.uk/images/ic/314x176/p01tlf61.jpg,Rescuing the pets left behind in Ukraine
https://www.bbc.co.uk/programmes/w172xv5nm3t1wjz,Programmes,BBC World Service,7 days ago,https://ichef.bbci.co.uk/images/ic/314x176/p0bxvn3p.jpg,Newshour: Ukraine spy boss says Russia wants to split country in two
https://www.bbc.co.uk/programmes/w3ct3khp,Programmes,BBC World Service,in 13 hours,https://ichef.bbci.co.uk/images/ic/314x176/p08vpp9b.jpg,The Climate Question: What does war in Ukraine mean for the climate? Part 2: Energy Security
https://www.bbc.co.uk/sport/football/60891701,Programmes,BBC World Service,Scottish,https://ichef.bbci.co.uk/news/416/cpsprodpb/9E3D/production/_114590504_gossipindex.png,"Scottish Gossip: Rangers, Celtic, Real Madrid, Arsenal, Tierney, Morelos, Hearts, McKay, Davis, Ukraine, Scotland"
https://www.bbc.co.uk/news/uk-60862891,News,BBC World Service,UK,https://ichef.bbci.co.uk/news/416/cpsprodpb/9AE9/production/_123875693_p0bxds7c.jpg,Ukraine war: I’m not optimistic Putin wants peace – Johnson
https://www.bbc.co.uk/programmes/m0015ly0,Programmes,BBC Radio 4,24 March,https://ichef.bbci.co.uk/images/ic/314x176/p0bww1rb.jpg,The Briefing Room: Russia's invasion: what more can the west do to help Ukraine?
https://www.bbc.co.uk/programmes/p01tdx1n,Programmes,BBC World Service,24 March,https://ichef.bbci.co.uk/images/ic/314x176/p08dwm55.jpg,"Russia, Ukraine And The World"
https://www.bbc.co.uk/programmes/m0015nr9,Programmes,BBC Radio 4,25 March,https://ichef.bbci.co.uk/images/ic/314x176/p0bscr5y.jpg,Letter from Ukraine: Displaced Lives
https://www.bbc.co.uk/programmes/m0015tpv,Programmes,BBC Radio 4,7 days ago,https://ichef.bbci.co.uk/images/ic/314x176/p0byxzst.jpg,Six O'Clock News: 27/03/2022 Fears of Ukraine split
https://www.bbc.co.uk/programmes/m0015tnm,Programmes,BBC Radio 4,7 days ago,https://ichef.bbci.co.uk/images/ic/314x176/p04fl8xj.jpg,"Sunday: 'Good versus evil' in Ukraine, Taliban U-turn on girls' education, The Merchant of Venice"
https://www.bbc.co.uk/programmes/p0bvb398,Programmes,BBC World Service,14 March,https://ichef.bbci.co.uk/images/ic/314x176/p09kz0v5.jpg,Global News Podcast: Ukraine: Fighting continues despite talks
https://www.bbc.co.uk/programmes/p0bx9gc8,Programmes,BBC World Service,BBC Radio Ulster,https://ichef.bbci.co.uk/images/ic/314x176/p029sm96.jpg,"Talkback: Today marks a grim milestone for the people of Ukraine, one month since the Russian assault on their country began."
https://www.bbc.co.uk/news/uk-wales-60875241,News,BBC World Service,Wales,https://ichef.bbci.co.uk/news/416/cpsprodpb/1334E/production/_123907687_finish.jpg,Cardiff Half: Ukraine refugee's Mother's Day race emotion
https://www.bbc.co.uk/news/uk-60858511,News,BBC World Service,UK,https://ichef.bbci.co.uk/news/416/cpsprodpb/1814D/production/_123873689_hi074836165.jpg,War in Ukraine: UK unveils new Russia sanctions as PM aims at gold reserves
https://www.bbc.co.uk/news/uk-60890431,News,BBC World Service,UK,https://ichef.bbci.co.uk/news/416/cpsprodpb/14528/production/_123904238_hi074817329.jpg,Ukraine war: Liz Truss says Russia sanctions should end only after withdrawal
https://www.bbc.co.uk/programmes/p0brz4x1,Programmes,BBC World Service,BBC Essex,https://ichef.bbci.co.uk/images/ic/314x176/p09htplx.jpg,Ben Fryer: Ukraine Charity Worker and Small Cinemas (24/03/2022)
https://www.bbc.co.uk/news/uk-england-devon-60892484,News,BBC World Service,Devon,https://ichef.bbci.co.uk/news/416/cpsprodpb/14D0C/production/_123906258_refugees.jpg,Ukraine conflict: West Devon family to take in 11 refugees
https://www.bbc.co.uk/news/world-europe-60886881,News,BBC World Service,Europe,https://ichef.bbci.co.uk/news/416/cpsprodpb/00C8/production/_123900200_biden_meeting_reuters.jpg,Ukraine daily round-up: Biden meets Ukrainian ministers
https://www.bbc.co.uk/news/science-environment-60879025,News,BBC World Service,Science & Environment,https://ichef.bbci.co.uk/news/416/cpsprodpb/710C/production/_123904982_478ce681-2ea5-42ad-bd63-6ccffb81e15f.jpg,Ukraine war: Chernobyl’s vodka producer remains defiant
https://www.bbc.co.uk/news/world-49434667,News,BBC World Service,World,https://ichef.bbci.co.uk/news/416/cpsprodpb/9CBF/production/_123872104_gettyimages-476259822.jpg,G7: What is the G7 and what is it doing about Ukraine?
https://www.bbc.co.uk/news/uk-england-manchester-60862625,News,Unknown,Manchester,https://ichef.bbci.co.uk/news/416/cpsprodpb/D602/production/_123868745_epa-nc.jpg,Ukraine war: Manchester fund launched for local refugees
https://www.bbc.co.uk/news/uk-england-london-60887157,News,Unknown,London,https://ichef.bbci.co.uk/news/416/cpsprodpb/DD22/production/_123901665_hi074886657.jpg,Ukraine: Sadiq Khan says UK should do more to help refugees
https://www.bbc.co.uk/programmes/m0015rtf,Programmes,Unknown,BBC Radio Wales,https://ichef.bbci.co.uk/images/ic/314x176/p0997dz3.jpg,"Sunday Supplement: Ukraine, economy and nuclear test veterans"
https://www.bbc.co.uk/news/world-europe-60858611,News,Unknown,Europe,https://ichef.bbci.co.uk/news/416/cpsprodpb/7694/production/_123865303_p0bx6fmg.jpg,War in Ukraine: Zelensky calls on people to 'support freedom' and oppose Russia
https://www.bbc.co.uk/news/world-europe-60849917,News,Unknown,Europe,https://ichef.bbci.co.uk/news/416/cpsprodpb/10FF8/production/_123842696_macronscholz.jpg,Western leaders meet to discuss Ukraine support
https://www.bbc.co.uk/news/world-europe-60889257,News,Unknown,Europe,https://ichef.bbci.co.uk/news/416/cpsprodpb/CEB8/production/_123902925_p0bxqk6h.jpg,War in Ukraine: Musicians perform emotional concert in Kharkiv metro station
https://www.bbc.co.uk/news/uk-england-hampshire-60854173,News,Unknown,Hampshire & Isle of Wight,https://ichef.bbci.co.uk/news/416/cpsprodpb/B622/production/_123862664_p0bx4d0l.jpg,Ukraine: Former Southampton Toys R Us reopens as donation centre
https://www.bbc.co.uk/programmes/w172xv368xzngbw,Programmes,BBC World Service,24 March,https://ichef.bbci.co.uk/images/ic/314x176/p085qr7m.jpg,Newsday: Ukraine: President Biden meets his Nato partners in Brussels later today
https://www.bbc.co.uk/programmes/m0015tvl,Programmes,BBC Radio 4,26 March,https://ichef.bbci.co.uk/images/ic/314x176/p02gmvyk.jpg,Any Answers?: Ukraine & Cost of Living
https://www.bbc.co.uk/news/world-europe-60125659,News,BBC Radio 4,Europe,https://ichef.bbci.co.uk/news/416/cpsprodpb/1DEC/production/_123706670_chanel.jpg,What sanctions are being imposed on Russia over Ukraine invasion?
https://www.bbc.co.uk/news/world-europe-60854503,News,Unknown,Europe,https://ichef.bbci.co.uk/news/416/cpsprodpb/AC5C/production/_123842144_p0bx338b.jpg,Ukraine war: Destruction of cities shown from above
https://www.bbc.co.uk/news/world-europe-60807538,News,Unknown,Europe,https://ichef.bbci.co.uk/news/416/cpsprodpb/160BB/production/_123899209_672f818f-044b-4bb2-b39f-a2d234845874.jpg,Russian general Yakov Rezantsev killed in Ukraine
https://www.bbc.co.uk/news/uk-60886181,News,Unknown,UK,https://ichef.bbci.co.uk/news/416/cpsprodpb/1336B/production/_123899687_hi074449102.jpg,Ukraine war: Oligarch Eugene Shvidler's jets held indefinitely
https://www.bbc.co.uk/sport/football/60858821,News,Unknown,Scottish,https://ichef.bbci.co.uk/news/416/cpsprodpb/9E3D/production/_114590504_gossipindex.png,"Scottish Gossip: Rangers, Celtic, Scotland, Ukraine, King, Rogic, Sakala, Ralston, Roofe, Dundee, St Johnstone, Musonda"
https://www.bbc.co.uk/programmes/m0016hhw,Programmes,BBC Radio 4,in 18 days,https://ichef.bbci.co.uk/images/ic/314x176/p0bscr5y.jpg,Letter from Ukraine: Episode 8
https://www.bbc.co.uk/news/technology-60850729,News,BBC Radio 4,Technology,https://ichef.bbci.co.uk/news/416/cpsprodpb/9730/production/_123840783_gettyimages-1239388820.jpg,Ukraine war: Fortnite owner Epic Games raises £37m for humanitarian efforts
